{
  "auto_merge_allowed": false,
  "auto_ready_allowed": false,
  "checks_status": "SUCCESS",
  "claim_verdict": "NO_CLAIM_ALLOWED",
  "evidence_verdict": "LOCAL_REVIEW_SUMMARY_ONLY",
  "execution_report_status": "PRESENT",
  "human_decision_status": "PRESENT",
  "human_gate_required": true,
  "next_action": "Human founder may decide whether to ready and merge after confirming required checks.",
  "pack_id": "LRP-301-cccccccccccc",
  "pr_decision_packet_status": "PRESENT",
  "recommended_decision": "GO_READY_AND_MERGE",
  "review_packet_status": "PRESENT",
  "risks": [],
  "schema_version": "studiopilot.local_review_pack.v0",
  "scope_status": "OK",
  "software_verdict": "SAFE",
  "source_head_sha": "cccccccccccccccccccccccccccccccccccccccc",
  "source_pr_number": 301,
  "summary_lines": [
    "PR 301 at cccccccccccccccccccccccccccccccccccccccc summarized from local control-plane inputs.",
    "ExecutionReport PRESENT; ReviewPacket PRESENT; HumanDecision PRESENT.",
    "Checks SUCCESS; scope OK; software SAFE.",
    "Claim verdict NO_CLAIM_ALLOWED; HumanGate required.",
    "Recommendation GO_READY_AND_MERGE."
  ],
  "touched_surfaces": {
    "benchmark": false,
    "control_plane_tooling": true,
    "docs": true,
    "ml_training": false,
    "neural": false,
    "runtime": false,
    "schemas": true,
    "search": false,
    "workflows": false
  }
}
